{
  "protocol_version": "1.0.0",
  "case_id": "contract_no_probabilities",
  "case_type": "CONTRACT",
  "description": "Defensible probabilities are unavailable, so expected return is null and action is WATCH.",
  "fixture": {
    "base_report": "../../fixtures/base_report.json",
    "report_patch": {
      "report_id": "synthetic-no-probabilities",
      "recommendation": {
        "action": "WATCH",
        "expected_total_return": null,
        "expected_annualized_return": null,
        "risk_premium": null,
        "rationale": "Scenario probabilities cannot be set responsibly."
      },
      "scenarios": [
        {
          "name": "Bear",
          "probability": null,
          "intrinsic_value_as_of": 145.0,
          "target_value_at_horizon": 155.0,
          "cumulative_dividends": 2.0,
          "total_return": -0.215,
          "annualized_return": -0.11399774266653251,
          "driver_assumptions": ["Growth slows materially."]
        },
        {
          "name": "Base",
          "probability": null,
          "intrinsic_value_as_of": 230.0,
          "target_value_at_horizon": 240.0,
          "cumulative_dividends": 2.0,
          "total_return": 0.21,
          "annualized_return": 0.10000000000000009,
          "driver_assumptions": ["Growth and margins remain stable."]
        },
        {
          "name": "Bull",
          "probability": null,
          "intrinsic_value_as_of": 285.0,
          "target_value_at_horizon": 300.0,
          "cumulative_dividends": 2.0,
          "total_return": 0.51,
          "annualized_return": 0.22882057274445078,
          "driver_assumptions": ["Growth and margins exceed the base case."]
        }
      ]
    }
  },
  "evaluators": ["C001", "C002", "N001", "N003", "D001"],
  "expected_report": {
    "status": "COMPLETE",
    "recommendation": "WATCH"
  },
  "expected_harness": {
    "verdict": "PASS"
  },
  "numeric_tolerance": 1e-09
}
