{
  "protocol_version": "1.0.0",
  "case_id": "contract_incomplete",
  "case_type": "CONTRACT",
  "description": "A critical evidence gap produces INCOMPLETE with WATCH.",
  "fixture": {
    "base_report": "../../fixtures/base_report.json",
    "report_patch": {
      "report_id": "synthetic-incomplete",
      "status": "INCOMPLETE",
      "recommendation": {
        "action": "WATCH",
        "rationale": "A material source is unavailable."
      },
      "audit": {
        "latest_filings_checked": false,
        "critical_gaps": ["A material source is unavailable."]
      }
    }
  },
  "evaluators": ["C001", "C002", "N001", "N003", "D001"],
  "expected_report": {
    "status": "INCOMPLETE",
    "recommendation": "WATCH"
  },
  "decision_context": {
    "critical_evidence_gaps": ["A material source is unavailable."]
  },
  "expected_harness": {
    "verdict": "PASS"
  },
  "numeric_tolerance": 1e-09
}

